<?xml version="1.0"?>
<?xml-stylesheet type="text/xsl" href="versao2.xsl"?>
<!DOCTYPE note SYSTEM "guiao.dtd">
<guiao>
	<cabecalho>
		<titulo>Título do Filme</titulo>
		<autores>
			<autor>Autor 1</autor>
			<autor>Autor 2</autor>		
		</autores>
		<data_publicacao><ano>2013</ano><mes>03</mes><dia>16</dia></data_publicacao>
		<personagens>
			<personagem id="p1">
				<nome>Personagem 1</nome>
				<descricao>Personagem 1. Declarada no cabeçalho.</descricao>
			</personagem>
			<personagem id="p2">
				<nome>Personagem 2</nome>
				<descricao>Personagem 2. Declarada no cabeçalho.</descricao>
			</personagem>
		</personagens>
		<sinopse>Sinopse do guião no cabeçalho.</sinopse>
	</cabecalho>
	<episodios>
		<episodio id="e1">
			<titulo>Episódio 1. Só com título</titulo>
			<personagens>
				<personagem id="p5">
					<nome>Personagem 5. Declarada na temporada 2</nome>
					<descricao>Descrição da personagem 5</descricao>
				</personagem>
			</personagens>
		</episodio>
		<episodio id="e2">
			<titulo>Episódio 2. Com partes</titulo>
			<partes>
				<parte id="parte1">
					<titulo>Primeira Parte. Só com título e sinopse.</titulo>
					<sinopse>Sinopse da parte 1 do episódio 2 da temporada 2.</sinopse>
				</parte>
				<parte id="parte2">
					<titulo>Primeira Parte. Com cenas.</titulo>
					<sinopse>Sinopse da parte 2 do episódio 2 da temporada 2.</sinopse>
					<personagens>
						<personagem id="p3">
							<nome>Personagem 3</nome>
							<descricao>Personagem 3. Declarada na parte 2.</descricao>
						</personagem>
					</personagens>
					<cenas>
						<cena contexto="Contexto da cena 1.">
						    <fala personagem="p1">Vou te matar!</fala>
						    Enquanto diz isto pega na <adereco>pistola</adereco> e dispara.
						    <fala personagem="p2">Ahh, mataste-me...</fala>
						    E cai morto no chão.
						    <fala personagem="p3">123</fala>
						</cena>
						<cena contexto = "Absolute bedlam. 300 drunken STOCKBROKERS, most in their early 20s">
						    <fala personagem="p1">Vou te matar, personagem 2!</fala>
						    Enquanto diz isto o <refere personagem="p1">personagem 1</refere> pega na <adereco>pistola</adereco> e dispara.
						    <fala personagem="p2">Ahh, mataste-me...</fala>
						    E o <refere personagem="p2">personagem 2</refere> cai morto no chão.
						</cena>							
					</cenas>
				</parte>
			</partes>
		</episodio>
		<episodio id="e3">
			<titulo>Episódio 2. Só com título</titulo>
			<personagens>
				<personagem id="p4">
					<nome>Personagem 4. Declarada num episódio</nome>
					<descricao>Personagem 4. Declarada num episódio</descricao>
				</personagem>
			
			</personagens>
			<!-- <temporada id="t98"><titulo>Temporada 98</titulo></temporada> -->
		</episodio>
	</episodios>
</guiao>