<?xml version="1.0" encoding="UTF-8" ?>
<?xml-stylesheet type="text/xsl" href="versao2.xsl"?>
<!DOCTYPE note SYSTEM "guiao.dtd">
<guiao>
	<cabecalho>
		<titulo>Título do Filme</titulo>
		<autores>
			<autor>Autor 1</autor>
			<autor>Autor 2</autor>		
		</autores>
		<data_publicacao><ano>2013</ano><mes>03</mes><dia>12</dia></data_publicacao>
		<personagens>
			<personagem id="p1">
				<nome>Personagem 1</nome>
				<descricao>Personagem 1. Declarada no cabeçalho.</descricao>
			</personagem>
			<personagem id="p2">
				<nome>Personagem 2</nome>
				<descricao>Personagem 2. Declarada no cabeçalho.</descricao>
			</personagem>
			<personagem id="p3">
				<nome>Personagem 3</nome>
				<descricao>Personagem 3. Declarada no cabeçalho.</descricao>
			</personagem>
		</personagens>
		<sinopse>
			Sinopse do guião no cabeçalho.
			Sinopse do guião no cabeçalho.
			Sinopse do guião no cabeçalho. 
		</sinopse>
	</cabecalho>
	<cenas>
		<cena contexto="Contexto da cena 1.">
		    <fala personagem="p1">Vou te matar!</fala>
		    Enquanto diz isto pega na <adereco>pistola</adereco> e dispara.
		    <fala personagem="p2">Ahh, mataste-me...</fala>
		    E cai morto no chão.
		    <fala personagem="p3">123</fala>
		</cena>
		<cena contexto = "Absolute bedlam. 300 drunken STOCKBROKERS, most in their early 20s, ">
		    <fala personagem="p1">
		    	Vou te matar com a minha <adereco>pistola</adereco>, <refere personagem="p2">personagem 2</refere>!
		    	<comentario>
		    		O <refere personagem="p1">personagem 1</refere> está com cara de que está a falar mesmo a sério.
		    	</comentario>
		    </fala>
		    Enquanto diz isto o <refere personagem="p1">personagem 1</refere> pega na <adereco>pistola</adereco> e dispara.
	    	<comentario>
	    		Esta parte é em câmara lenta. 
	    		A bala parte da <adereco>pistola</adereco> e vai direitinha a caminho do coração do <refere personagem="p2">personagem 2</refere>
	    	</comentario>
		    <fala personagem="p2">Ahh, mataste-me...</fala>
		    E o <refere personagem="p2">personagem 2</refere> cai morto no chão.
		</cena>
	</cenas>
</guiao>